e2b980ab-7c05-c422-c6ae-0dbd7eca6a3c,https://www.natole.store/product-page/%D1%81%D1%83%D0%B4%D1%83%D0%B3%D1%83%D0%BD%D1%96-%D0%BD%D0%B8%D1%82%D0%BA%D0%B0-%D0%B7%D1%96-%D1%81%D0%BC%D0%B0%D0%BA%D0%BE%D0%BC-%D0%BB%D0%BE%D0%B1%D1%81%D1%82%D0%B5%D1%80%D0%B0?utm_source=google%26utm_medium%3Dwix_google_channel%26utm_campaign%3Dfreelistings&utm_source=google&utm_medium=wix_google_feed&utm_campaign=freelistings,Сулугуні нитка зі смаком лобстера 100 грам ,instock,<p>Сулугуні нитка зі смаком Лобстера </p><p>Порційне фасування по 100 грам</p>,https://static.wixstatic.com/media/3df2bb_934a270ad2384c92a83cff21e8b7533d~mv2.jpg/v1/fit/w_744%2Ch_744%2Cq_90/file.jpg,51,51,Natole store,e2b980ab-7c05-c422-c6ae-0dbd7eca6a3c,true,new,,,,,"https://static.wixstatic.com/media/3df2bb_641299d67d99451e99688b2b4ba0b0f1~mv2.jpeg/v1/fit/w_2924%2Ch_2923%2Cq_90/file.jpg,https://static.wixstatic.com/media/3df2bb_9cff7064ba35403592836e577763fede~mv2.jpg/v1/fit/w_3000%2Ch_3000%2Cq_90/file.jpg",
dc2c1581-00f6-75a9-0645-198437fa5e00,https://www.natole.store/product-page/%D1%81%D1%83%D0%BB%D1%83%D0%B3%D1%83%D0%BD%D1%96-%D0%BD%D0%B8%D1%82%D0%BA%D0%B0-%D0%B7%D1%96-%D1%81%D0%BC%D0%B0%D0%BA%D0%BE%D0%BC-%D1%81%D0%BC%D0%B5%D1%82%D0%B0%D0%BD%D0%B8-%D1%82%D0%B0-%D0%B7%D0%B5%D0%BB%D0%B5%D0%BD%D1%96-100-%D0%B3%D1%80%D0%B0%D0%BC?utm_source=google%26utm_medium%3Dwix_google_channel%26utm_campaign%3Dfreelistings&utm_source=google&utm_medium=wix_google_feed&utm_campaign=freelistings,Сулугуні нитка зі смаком сметани та зелені 100 грам ,instock,<p>Сулугуні нитка зі смаком сметани та зелені </p><p>Порцій фасування по 100 грам</p>,https://static.wixstatic.com/media/3df2bb_1923fdf022474316a7775c689813afc8~mv2.jpg/v1/fit/w_588%2Ch_588%2Cq_90/file.jpg,51,51,Natole store,dc2c1581-00f6-75a9-0645-198437fa5e00,true,new,,,,,"https://static.wixstatic.com/media/3df2bb_120a545b055641d393fcc01854aaf3a5~mv2.jpeg/v1/fit/w_2924%2Ch_2923%2Cq_90/file.jpg,https://static.wixstatic.com/media/3df2bb_dbb6a6cc8f5a4dafaed3c230e4ec751a~mv2.jpg/v1/fit/w_3000%2Ch_3000%2Cq_90/file.jpg",
13206356-2fe2-a209-d1ab-6b54f546cb41,https://www.natole.store/product-page/%D0%B0%D1%80%D0%B0%D1%85%D1%96%D1%81-%D0%B7%D1%96-%D1%81%D0%BC%D0%B0%D0%BA%D0%BE%D0%BC-%D0%BA%D1%80%D0%B0%D0%B1%D1%83?utm_source=google%26utm_medium%3Dwix_google_channel%26utm_campaign%3Dfreelistings&utm_source=google&utm_medium=wix_google_feed&utm_campaign=freelistings,Арахіс зі смаком Крабу,instock,<p>Смажений солоний арахіс зі смаком Крабу</p>,https://static.wixstatic.com/media/145cef_e123729563bc41038171b0c80949a3ee~mv2.jpg/v1/fit/w_1080%2Ch_1080%2Cq_90/file.jpg,198,198,Natole store,13206356-2fe2-a209-d1ab-6b54f546cb41,true,new,,,,,,1.0 kg
cd4f980d-e028-b292-7ac7-dc14ef260272,https://www.natole.store/product-page/%D0%B0%D1%80%D0%B0%D1%85%D1%96%D1%81-%D1%81%D0%BC%D0%B5%D1%82%D0%B0%D0%BD%D0%B0-%D1%82%D0%B0-%D0%B7%D0%B5%D0%BB%D0%B5%D0%BD%D1%8C?utm_source=google%26utm_medium%3Dwix_google_channel%26utm_campaign%3Dfreelistings&utm_source=google&utm_medium=wix_google_feed&utm_campaign=freelistings,Арахіс Сметана та зелень,instock,<p>Смажений солоний арахіс зі смаком Сметани та зелені </p>,https://static.wixstatic.com/media/145cef_3cc1357166f84a8e96759b09fe71c07c~mv2.jpg/v1/fit/w_1080%2Ch_1080%2Cq_90/file.jpg,198,198,Natole store,cd4f980d-e028-b292-7ac7-dc14ef260272,true,new,,,,,,1.0 kg
3eb03dc4-bd99-8787-f9a0-2f34dcd863cc,https://www.natole.store/product-page/%D0%B0%D1%80%D0%B0%D1%85%D1%96%D1%81-%D1%82%D0%B5%D0%BB%D1%8F%D1%82%D0%B8%D0%BD%D0%B0-%D0%B7-%D0%B0%D0%B4%D0%B6%D0%B8%D0%BA%D0%BE%D1%8E?utm_source=google%26utm_medium%3Dwix_google_channel%26utm_campaign%3Dfreelistings&utm_source=google&utm_medium=wix_google_feed&utm_campaign=freelistings,Арахіс Телятина з Аджикою,instock,"<p>Арахіс смажений зі смаком Телятини з Аджикою</p><p>не лише ідеальне доповнення до пінного , але і чудова самостійна закуска.</p><p>Наш інтернет-магазин пропонує вам купити арахіс смажений зі смаком Телятини та Аджики за доступною ціною. Ми пропонуємо тільки натуральний продукт, доставку якого можна замовити в будь-яку точку України.</p>",https://static.wixstatic.com/media/145cef_e123729563bc41038171b0c80949a3ee~mv2.jpg/v1/fit/w_1080%2Ch_1080%2Cq_90/file.jpg,198,198,Natole store,3eb03dc4-bd99-8787-f9a0-2f34dcd863cc,true,new,,,,,,
d870e10c-780f-74fa-1f5c-4dadf3d8b832,https://www.natole.store/product-page/%D0%BA%D0%BE%D0%B2%D0%B1%D0%B0%D1%81%D0%B0-%D0%BD%D0%B0%D1%80%D1%96%D0%B7%D0%BA%D0%B0-%D1%81-%D0%BA-fuet-de-la-cantre-75-%D0%B3%D1%80%D0%B0%D0%BC?utm_source=google%26utm_medium%3Dwix_google_channel%26utm_campaign%3Dfreelistings&utm_source=google&utm_medium=wix_google_feed&utm_campaign=freelistings,Ковбаса-нарізка С/К  “Fuet de la CANTRE”   75 грам,instock,"<p>Ковбаса фует виготовляється зі свинини, свинячого жиру та спецій. Фарш подрібнюється, наповнюється та залишається на дозрівання. Сиров'ялений делікатес покривається білою їстівною пліснявою, яка надає грибного аромату.</p><p>Ковбасу рекомендується тонко нарізати та подавати разом з овочами, оливками, сиром. Гарно смакує фует з соусами та джемами.</p><p></p>",https://static.wixstatic.com/media/3df2bb_3113490e93944719a50c0effa0eae0cc~mv2.jpg/v1/fit/w_2160%2Ch_2700%2Cq_90/file.jpg,56,56,Natole store,d870e10c-780f-74fa-1f5c-4dadf3d8b832,true,new,,,,,,0.075 kg
07dab034-7df7-c58f-c23e-1639c1630f27,https://www.natole.store/product-page/%D0%BF%D0%B0%D0%BB%D0%B8%D1%87%D0%BA%D0%B8-%D1%96%D0%BA%D1%80%D0%B8-%D0%BC%D0%B5%D0%BD%D1%82%D0%B0%D1%8E?utm_source=google%26utm_medium%3Dwix_google_channel%26utm_campaign%3Dfreelistings&utm_source=google&utm_medium=wix_google_feed&utm_campaign=freelistings,Палички ікри Ментаю 0.5 кг,instock,<p>Палички з ікри ментаю у вакуумі </p>,https://static.wixstatic.com/media/3df2bb_3d7293daefae41779a8ca90444d20dff~mv2.jpg/v1/fit/w_3000%2Ch_3000%2Cq_90/file.jpg,553,553,Natole store,07dab034-7df7-c58f-c23e-1639c1630f27,true,new,,,,,,0.5 kg
052b3d2d-40ad-6cb9-84ce-a6ea0fcac645,https://www.natole.store/product-page/%D1%80%D0%B8%D0%B1%D0%BD%D0%B0-%D0%BF%D0%B0%D0%B2%D1%83%D1%82%D0%B8%D0%BD%D0%B0-%D0%B7%D1%96-%D1%81%D0%BC%D0%B0%D0%BA%D0%BE%D0%BC-%D1%80%D0%B0%D0%BA%D1%96%D0%B2?utm_source=google%26utm_medium%3Dwix_google_channel%26utm_campaign%3Dfreelistings&utm_source=google&utm_medium=wix_google_feed&utm_campaign=freelistings,Рибна павутина зі смаком Раків,instock,<p>Ніжна рибна павутина з тонким смаком раків </p><p>Фасування 1 кг</p>,https://static.wixstatic.com/media/3df2bb_04bdcfa8e664475f80a06b21300d05e1~mv2.jpg/v1/fit/w_3000%2Ch_3000%2Cq_90/file.jpg,487,487,Natole store,052b3d2d-40ad-6cb9-84ce-a6ea0fcac645,true,new,,,,,,1.0 kg
a440512e-b9e3-1724-fb83-2adbdcacb717,https://www.natole.store/product-page/%D1%80%D0%B8%D0%B1%D0%BD%D0%B0-%D0%BF%D0%B0%D0%B2%D1%83%D1%82%D0%B8%D0%BD%D0%B0-%D0%B7%D1%96-%D1%81%D0%BC%D0%B0%D0%BA%D0%BE%D0%BC-%D0%BA%D1%80%D0%B5%D0%B2%D0%B5%D1%82%D0%BE%D0%BA?utm_source=google%26utm_medium%3Dwix_google_channel%26utm_campaign%3Dfreelistings&utm_source=google&utm_medium=wix_google_feed&utm_campaign=freelistings,Рибна павутина зі смаком Креветок ,instock,<p>Ніжна рибна павутинка з тонким смаком креветок </p><p></p><p>Фасування 1кг</p>,https://static.wixstatic.com/media/3df2bb_04bdcfa8e664475f80a06b21300d05e1~mv2.jpg/v1/fit/w_3000%2Ch_3000%2Cq_90/file.jpg,487,487,Natole store,a440512e-b9e3-1724-fb83-2adbdcacb717,true,new,,,,,,1.0 kg
549f9587-b9e2-0bfb-54de-b214e19d7fef,https://www.natole.store/product-page/%D1%96%D0%BA%D1%80%D0%B0-%D1%82%D0%BE%D0%B2%D1%81%D1%82%D0%BE%D0%BB%D0%BE%D0%B1%D0%B0-0-5?utm_source=google%26utm_medium%3Dwix_google_channel%26utm_campaign%3Dfreelistings&utm_source=google&utm_medium=wix_google_feed&utm_campaign=freelistings,Ікра товстолоба 0.5,instock,<p>Ікра товстолоба сушена</p><p>Фасування 0.5кг</p>,https://static.wixstatic.com/media/3df2bb_9d836e57218f40fd935f8531ded90b17~mv2.jpg/v1/fit/w_3000%2Ch_3000%2Cq_90/file.jpg,589,589,Natole store,549f9587-b9e2-0bfb-54de-b214e19d7fef,true,new,,,,,,0.5 kg
f56520de-cb54-0ad1-903a-fa17217aa0fa,https://www.natole.store/product-page/%D0%BF%D0%B0%D1%80%D0%BC%D0%B5%D0%B7%D0%B0%D0%BD-gojus-gold-%D0%B2%D0%B0%D0%B3%D0%BE%D0%B2%D0%B8%D0%B9?utm_source=google%26utm_medium%3Dwix_google_channel%26utm_campaign%3Dfreelistings&utm_source=google&utm_medium=wix_google_feed&utm_campaign=freelistings,Пармезан Gojus Gold  ваговий,instock,"<p>Пармезан Gojus Gold Польського виробництва </p><p></p><p>-УВАГА- </p><p>Продукт ваговий , перед сплатою проконсультуйтесь з менеджером !!!</p>",https://static.wixstatic.com/media/3df2bb_6db3b684557e46b5a8b62c56e52576d0~mv2.jpg/v1/fit/w_2160%2Ch_2160%2Cq_90/file.jpg,579,579,Natole store,f56520de-cb54-0ad1-903a-fa17217aa0fa,true,new,,,,,,1.0 kg
fedcaa04-cc08-ad77-0e72-42788f496f6c,https://www.natole.store/product-page/%D0%BA%D0%BE%D0%B2%D0%B1%D0%B0%D1%81%D0%B0-%D1%81%D1%83%D1%85%D0%B0-%D1%80%D0%B0%D0%BD%D1%87%D0%BE-%D1%81-%D0%BA-%D0%B2%D0%B0%D0%B3%D0%BE%D0%B2%D0%B0?utm_source=google%26utm_medium%3Dwix_google_channel%26utm_campaign%3Dfreelistings&utm_source=google&utm_medium=wix_google_feed&utm_campaign=freelistings,Ковбаса «Суха» Ранчо  С/К   В/С Вагова,instock,"<p>Ковбаса с/к в/с Суха Ранчо</p><p></p><p>Оболонка неістівна Упаковано під вакуумом Склад: свинина</p><p>знежилована нежирна-62%, сало ковбасне хребтове.23%,</p><p>яловичина знежилована першого сорту 9%, сіль кухонна. декстроза, підсилювач смаку та аромату Е621, прянощі, антиоксидант Е300, ароматизатори, екстракт прянощів, цукор, регулятор кислотності Е330, спеції та екстракти спецій (перець чорний, перець білий, мускатний горіх, часник), стабілізатори Е451, Е452, стартова культура, консервант Е250. Може ністити спіди дечних, молочних продуктів, глютену, гірчиці, селери.</p>",https://static.wixstatic.com/media/3df2bb_d027bdcb92754c87a60284b872c87183~mv2.jpg/v1/fit/w_2160%2Ch_2700%2Cq_90/file.jpg,462,462,Natole store,fedcaa04-cc08-ad77-0e72-42788f496f6c,true,new,,,,,,1.0 kg
448bb483-086f-613f-0df3-7290a5190f34,https://www.natole.store/product-page/%D0%BA%D0%BE%D0%B2%D0%B1%D0%B0%D1%81%D0%B0-%D1%81-%D0%B2-%D1%81-%D0%BC%D1%96%D0%BB%D0%B0%D0%BD%D0%BE-milano?utm_source=google%26utm_medium%3Dwix_google_channel%26utm_campaign%3Dfreelistings&utm_source=google&utm_medium=wix_google_feed&utm_campaign=freelistings,Ковбаса с/ в/с Мілано (Milano),instock,"<p>Ковбаса с/ в/с Мілано (Milano)</p><p>Оболонка неїстівна, містить підсолоджувач ТУ У 15.1 32122069.</p><p>004:2011 Упаковано в захисному середовищі Склад: свинина</p><p>энежилована нежирна 3%, сало ковбасне хребтове .11%, сль</p><p>морська, декстроза, підсилювач смаку та аромату Е621, спеції, антиоксидант Е300, екстракти спецій, цукор, регулятор кислотності Е330, антиоксидант Е316, ароматизатор, глюкоза, коптильний ароматизатор, підсолоджувач Е955, ароматична суміш (ароматизатори, картопляний мальтодекстрин), стартова культура, консервант Е250. Може містити сліди ясних, молочних продуктів, глютену, гірчиці, селери.</p><p>Спеціальні умови зберігання: за температури від ОС до 6С і відносної вологості повітря від 75% до 78%. Дозволяється білий наліт солі на поверхні оболонки Країна походження: Україна</p>",https://static.wixstatic.com/media/3df2bb_e396a09e45d04f0db163d57db6b6725b~mv2.jpg/v1/fit/w_2160%2Ch_2700%2Cq_90/file.jpg,475,475,Natole store,448bb483-086f-613f-0df3-7290a5190f34,true,new,,,,,,
8b0b0013-39d2-ec63-80dc-917eb34bcbf1,https://www.natole.store/product-page/%D0%BA%D0%BE%D0%B2%D0%B1%D0%B0%D1%81%D0%B0%D1%81-%D0%BA-%D0%B2-%D1%81-%D0%BD%D0%B0%D0%BF%D0%BE%D0%BB%D1%96-napoli?utm_source=google%26utm_medium%3Dwix_google_channel%26utm_campaign%3Dfreelistings&utm_source=google&utm_medium=wix_google_feed&utm_campaign=freelistings,Ковбасас/к в/с Наполі (Napoli),instock,"<p>Ковбаса с/к в/с Наполі (Napoli)</p><p>Оболонка неїстівна, містить підсолоджувач ТУ У 15.1 32122069.</p><p>004:2011 Упаковано в захисному середовищі Склад: свинина знежилована нежирна 83%, сало ковбасне хребтове 11%, сіль морська, декстроза, підсилювач смаку та аромату Е621, спецій, антиоксидант Е300, екстракти спецій, чукор, регулятор кислотності Е330, антиоксидант Е316, ароматизатор, глюкоз8, Коптильний ароматизатор, підсолоджувач Е955, ароматична суміш (ароматизатори, картопляний мальтодекстрин), стартова культура, консервант Е250. Може містити сліди яєчних, молочних продуктів, глютену, гірчиці, селери.</p><p>Спеціальні умови зберігання: за температури від ОС до 6Сі відносної вологості повітря від 75% до 78%. Дозволяється білий маліт солі на поверхні оболонки Країна походження: Україна</p>",https://static.wixstatic.com/media/3df2bb_c05d726641ab47ecad72d9343a5364ae~mv2.jpg/v1/fit/w_2160%2Ch_2700%2Cq_90/file.jpg,455,455,Natole store,8b0b0013-39d2-ec63-80dc-917eb34bcbf1,true,new,,,,,,
739fbb03-ce26-1526-9a4e-a34f1588e5a5,https://www.natole.store/product-page/%D0%BA%D0%BE%D0%B2%D0%B1%D0%B0%D1%81%D0%B0-%D1%81-%D0%BA-%D0%B2-%D1%81-%D0%BF%D1%80%D0%B5%D0%B7%D0%B8%D0%B4%D0%B5%D0%BD%D1%82%D1%81%D1%8C%D0%BA%D0%B0?utm_source=google%26utm_medium%3Dwix_google_channel%26utm_campaign%3Dfreelistings&utm_source=google&utm_medium=wix_google_feed&utm_campaign=freelistings,Ковбаса с/к в/с Президентська,instock,"<p>Ковбаса с/к в/с Президентська</p><p>Упаковано під вакуумом Оболонка неїстівна. Склад: свинина</p><p>знежилована нежирна-48%, сало ковбасне хребтове -29%,</p><p>яловичина знежилована першого сорту-19%, сіль кухонна, спеції та екстракти спецій (перець чорний, перець білий, мускатний горіх, часник), підсилюзач смаку та аромату Е621,</p><p>антиоксидант Е316, глюкоза, стартова культура, консервант</p><p>Е250. Може ністити сліди яєчних, молочних продуктів,</p><p>*лютену, гірчиці, селери.Спеціальні унови зберігання: повестрати за твиператури від ОС до 6С відносної вологості</p><p>повержні оболонки.</p><p>поверх нід73% до 78%. До зна пясть ся</p>",https://static.wixstatic.com/media/3df2bb_2fc3ad09647e4107897e8c9056b6133d~mv2.jpg/v1/fit/w_2160%2Ch_2700%2Cq_90/file.jpg,481,481,Natole store,739fbb03-ce26-1526-9a4e-a34f1588e5a5,true,new,,,,,,
c2a270ae-e146-eea3-a92d-8adbefdb4505,https://www.natole.store/product-page/%D0%BA%D0%BE%D0%B2%D0%B1%D0%B0%D1%81%D0%B0-%D1%81-%D0%BA-%D0%B2-%D1%81-%D0%BC%D0%B0%D1%85%D0%B0%D0%BD-%D0%BF%D0%BE-%D1%82%D0%B0%D1%82%D0%B0%D1%80%D1%81%D1%8C%D0%BA%D0%B8?utm_source=google%26utm_medium%3Dwix_google_channel%26utm_campaign%3Dfreelistings&utm_source=google&utm_medium=wix_google_feed&utm_campaign=freelistings,Ковбаса с/к в/с Махан по-татарськи,instock,"<p>Ковбаса с/к в/с Махан по-татарськи</p><p>ТУ У 15.1 32122069 004:2011 Оболонка неістівна. Упаковано під</p><p>вакуумом Склад: конина знежилована першого сорту - 52%, конина знежилована вищого сорту - 24%, сало ковбасне</p><p>бокове - 19%, сіль кухонна, спеції та екстракти спецій (перець чорний, перець білий, мускатний горіх, часник), підсилювач смаку та аромату Е621, антиоксидант Е316, коріандр, регулятор кислотності Е575, глюкоза, стартова культура, консервант Е250. Може містити сліди яєчних, молочних продуктів, глютену, гірчиці, селери. Спеціальні умови зберігання: зберігати за температури від ОС до 6С і відносної вологості повітря від 75% до 78%. Дозволяється білий напіт солі на поверхні оболонки.</p>",https://static.wixstatic.com/media/3df2bb_756d57897bbe4de297d38e5ca51c2eec~mv2.jpg/v1/fit/w_2160%2Ch_2700%2Cq_90/file.jpg,429,429,Natole store,c2a270ae-e146-eea3-a92d-8adbefdb4505,true,new,,,,,,
ba5d4a6d-b0ee-c33f-5b2e-955eec4b37dc,https://www.natole.store/product-page/%D0%BA%D0%BE%D0%B2%D0%B1%D0%B0%D1%81%D0%B0-%D1%81-%D0%BA-%D0%B2-%D1%81-%D1%81%D1%83%D1%88%D0%B5%D0%BD%D0%B0-%D0%B7%D1%96-%D1%81%D0%B2%D0%B8%D0%BD%D0%B8%D0%BD%D0%BE%D1%8E-%D1%80%D0%B0%D0%BD%D1%87%D0%BE?utm_source=google%26utm_medium%3Dwix_google_channel%26utm_campaign%3Dfreelistings&utm_source=google&utm_medium=wix_google_feed&utm_campaign=freelistings,Ковбаса с/к в/с Сушена зі свининою Ранчо,instock,"<p>Ковбаса с/к в/с Сушена зі свининою Ранчо</p><p></p><p>Оболонка неістівна Упаковано в захисному середовищі Складі</p><p>свинина энежилована нежирна 48%, сало ковбасне бокове 29%,</p><p>яловичина знежилована другого сорту-19%, сіль кухонна, спеції .та екстракти спецій (перець чорний, перець білий, мускатний горіх, часник), підсилювач смаку та аромату Е621, антиоксидант Е316, глюкоза, стабілізатор Е451, декстроза, ароматизатор салямі, стартова культура, консервант Е250. Може містити сліди яечних, молочних продуктів, глютену, гірчиці, селери.</p><p>Спеціальні умови зберігання: зберігати за температури від оС</p><p>Д0 6С і відносної вологості повітря від 75% до 78%. Допускається білий наліт солі на поверхні оболонки.</p>",https://static.wixstatic.com/media/3df2bb_22cb02ac7fa34a9796c5d1b1b6cf949d~mv2.jpg/v1/fit/w_2160%2Ch_2700%2Cq_90/file.jpg,445,445,Natole store,ba5d4a6d-b0ee-c33f-5b2e-955eec4b37dc,true,new,,,,,,
734be071-ceac-ffbf-9b86-6176e4dfeda6,https://www.natole.store/product-page/%D0%BA%D0%BE%D0%B2%D0%B1%D0%B0%D1%81%D0%B0-%D1%81-%D0%BA-%D0%B2-%D1%81-%D1%81%D1%83%D1%88%D0%B5%D0%BD%D0%B0-%D0%B7-%D1%8F%D0%BB%D0%BE%D0%B2%D0%B8%D1%87%D0%B8%D0%BD%D0%BE%D1%8E-%D1%80%D0%B0%D0%BD%D1%87%D0%BE?utm_source=google%26utm_medium%3Dwix_google_channel%26utm_campaign%3Dfreelistings&utm_source=google&utm_medium=wix_google_feed&utm_campaign=freelistings,Ковбаса с/к в/с Сушена з яловичиною Ранчо,instock,"<p>Ковбаса с/к в/с Сушена з яловичиною Ранчо</p><p>Оболонця неістівна ТУ У 15.1.32122069.004:2011 Улаковано в</p><p>захисному середовиш/ Складяловичина знажилована першого</p><p>сорту 29%, сало ковбасне бокове 29%, яловичина знажилована</p><p>вицого вірту - 19%, свинина знежилована нежирна - 19%, сіль кухонна, прянощі то екстракти прянощів (перець чорний, перець Ялий, коріандр, часнию), підсилювач смаку та зромату 6621, актіоксидант Е316, глюкоза, стартова культура, консервант Е20. Може містити сліди дечних, молочних продуктів, глютену, гірчиці, селери. Спаціальні умови збарігания.</p><p>зберігати за температури від 0 С до 6 С І відносиої вологості повітря від 75% до 78%. Допускається білий наліт солі на поверхит</p><p>обопанки.</p>",https://static.wixstatic.com/media/3df2bb_4f5f7963575e4b1b892fe8050ae7bb67~mv2.jpg/v1/fit/w_2160%2Ch_2700%2Cq_90/file.jpg,455,455,Natole store,734be071-ceac-ffbf-9b86-6176e4dfeda6,true,new,,,,,,
93880aa3-f1f7-e25b-9a73-b3b71e7c19fd,https://www.natole.store/product-page/%D0%BA%D0%BE%D0%B2%D0%B1%D0%B0%D1%81%D0%B0-%D1%81-%D0%BA-%D0%B2-%D1%81-%D1%83%D0%BA%D1%80%D0%B0%D1%97%D0%BD%D1%81%D1%8C%D0%BA%D0%B0?utm_source=google%26utm_medium%3Dwix_google_channel%26utm_campaign%3Dfreelistings&utm_source=google&utm_medium=wix_google_feed&utm_campaign=freelistings,Ковбаса с/к в/с Українська,instock,"<p>Ковбаса с/к в/с Українська</p><p>Оболонка неїстівна ОСТУ 4427:2005 Упаковано в захисному середовищі Склад: яловичина знежилована вищого сорту -73%, сало ковбасне хребтове 24%, сіль кухонна, цукор, перець чорний мелений, горіх мускатний мелений, консервант Е250.</p><p>Може и істити сліди яечних, молочних продуктів, глютену. гірчиці, селери Спеціальні умови зберігання: зберігати за температури від ОС до 6С і відносної вологості повітря від 75% до 78%. Дозволяється білий наліт солі на поверхні оболонки</p>",https://static.wixstatic.com/media/3df2bb_dfc5177f9735438fb2957dd8a4025a5e~mv2.jpg/v1/fit/w_2160%2Ch_2700%2Cq_90/file.jpg,526,526,Natole store,93880aa3-f1f7-e25b-9a73-b3b71e7c19fd,true,new,,,,,,
